{
  "id": "SUPPLEMENT_0001",
  "title": "Neutral world supplement example",
  "supplement_type": "world",
  "target_domain": "worldbook",
  "status": "review",
  "content": "A neutral proposed world fact awaiting conflict review and human approval.",
  "effective_scope": "preexisting_world",
  "visibility": "public",
  "known_by": [],
  "unknown_to": [],
  "supersedes": [],
  "provenance": {
    "provided_by": "USER",
    "source_reference": "Human-authored supplement",
    "recorded_at": "2026-09-27T00:00:00Z"
  },
  "notes": "Example only; contains no Campaign fact."
}
